id,address,city,description,latitude,longitude,price,state,street,title,totalScore,categories,image_url
142,"Kanthirava Layout, Kanteerava Nagar, Nandini Layout, Bengaluru, Karnataka 560096, India",Bengaluru,Bollywood matinee idol honored with flowers & movie posters at a memorial site named after him.,13.0183709,77.5324008,,Karnataka,,Dr Puneeth Rajkumar Memorial,4.5,"Tourist attraction, Memorial park","https://lh5.googleusercontent.com/p/AF1QipN40Eq39-e4pZolMyaPxbgbn0-R1s8YVlK5eKMs=w1920-h1080-k-no,https://lh5.googleusercontent.com/p/AF1QipN8suZrtTV5m3oWC_ub7wb0fxCy0oFqOzpGJ9OM=w1920-h1080-k-no"
143,"157, Taralabalu Rd, Phase 3, Krishnappa Block, Ganganagar, Bengaluru, Karnataka 560032, India",Bengaluru,,13.016277,77.5914745,,Karnataka,"157, Taralabalu Rd",Rabindranath Tagore circle,4.5,Tourist attraction,"https://lh5.googleusercontent.com/p/AF1QipPsctGm6h9fdg_C-pwsOGHGYPmXXC8-fAiLOB8j=w1920-h1080-k-no,https://lh5.googleusercontent.com/p/AF1QipPE07-sEnmizq4LzONaVjGUJzdhHe0R-Tgl7q8=w1920-h1080-k-no"
144,"99, 2nd Main Rd, opposite Mother Dairy Road, SFS 208 Colony, Yelahanka, Bengaluru, Karnataka 560064, India",Bengaluru,,13.1003905,77.5732556,,Karnataka,"99, 2nd Main Rd, opposite Mother Dairy Road",SFS 2042 Exhibition Venue,,Tourist attraction,
145,"3HQH+2XP, 26th Main Rd, Judicial Layout, Nandini Layout, Bengaluru, Karnataka 560065, India",Bengaluru,,13.0875883,77.5799657,,Karnataka,"3HQH+2XP, 26th Main Rd",Sangolli Rayanna Park,4.3,"Tourist attraction, Park","https://lh5.googleusercontent.com/p/AF1QipMyTCgQrZmJBgU4BmadCqJPwk8ElgBKBaV8IXlN=w1920-h1080-k-no,https://lh5.googleusercontent.com/p/AF1QipOTs88uE55CcIIwd4gkv3XsbCpXF3vzPcb0IOHw=w1920-h1080-k-no"
146,"3GH4+M4F, Chikkabanavara, Guddahalli, Karnataka 560090, India",Guddahalli,,13.0791956,77.5053157,,Karnataka,3GH4+M4F,Arabian King Lingu's Palace,5.0,Tourist attraction,
147,"1, Kusmara Road, Ambedkar Veedhi, Mainpuri, Uttar Pradesh 205001, India",Mainpuri,,12.981887,77.594504,,Uttar Pradesh,"1, Kusmara Road",Yadav Traveling,,Tourist attraction,
148,"3GFF+5CF, Lakshmaiah Layout, Srikrupa Layout, Abbigere, Abbigere, Bengaluru, Karnataka 560015, India",Bengaluru,,13.0729421,77.5235321,,Karnataka,3GFF+5CF,Dalawai Nilayam,5.0,Tourist attraction,"https://lh5.googleusercontent.com/p/AF1QipOBdTW0yYdGOVeyNNU-QDIvmiQBMhQRZexMvucG=w1920-h1080-k-no,https://lh5.googleusercontent.com/p/AF1QipNmw6dp1xuk2Uubd5HA2yvlJwbi27Lz7aGRgfwG=w1920-h1080-k-no"
149,"2FPX+JJF, 5th Block HMT Layout, Nagasandra, Bengaluru, Karnataka 560073, India",Bengaluru,,13.0365743,77.4990476,,Karnataka,2FPX+JJF,Shreyasg,,Tourist attraction,
150,"2, Millers Road, Vasanth Nagar, Bengaluru, Karnataka 560051, India",Bengaluru,,12.9854791,77.5904847,,Karnataka,"2, Millers Road, Vasanth Nagar",National Military Memorial Park,4.5,"Tourist attraction, Park","https://lh5.googleusercontent.com/p/AF1QipN7aeeEFEXkVc3tTyjIkvZslXVU6-bYgYwGZdov=w1920-h1080-k-no,https://lh5.googleusercontent.com/p/AF1QipOVaBUiCGFVp-Q0LvL_i0jl_veMHx7BYw6Q3NXG=w1920-h1080-k-no"
151,"Mahatma Gandhi Institute, Rachenahalli, Thanisandra, Bengaluru, Karnataka 560064, India",Bengaluru,,13.0665921,77.6105061,,Karnataka,Mahatma Gandhi Institute,Karnataka raajya Museum,4.6,Tourist attraction,"https://lh5.googleusercontent.com/p/AF1QipPBD5jMoN8Xjt_jr6rxarfWDx-6kxcR1o-mnfKL=w1920-h1080-k-no,https://lh5.googleusercontent.com/p/AF1QipMREwdh-i5oVU_KH0Ix-dlLkeAjxsDLdew77kKk=w1920-h1080-k-no"
152,"XHGX+R8V, Dr Ambedkar Rd, Ambedkar Veedhi, Sampangi Rama Nagar, Bengaluru, Karnataka 560001, India",Bengaluru,,12.9771005,77.5982855,,Karnataka,"XHGX+R8V, Dr Ambedkar Rd",Proposed Yoga Inspiring Installation,,Tourist attraction,
153,"4H2M+HHV, New Town Main Rd, Yelahanka Satellite Town, Yelahanka, Bengaluru, Karnataka 560064, India",Bengaluru,,13.1014762,77.583918,,Karnataka,"4H2M+HHV, New Town Main Rd",Light street,4.8,Tourist attraction,"https://lh5.googleusercontent.com/p/AF1QipOckVa1bnF9_q4-NLMhrd8NwnpF2E1str3E2ZOd=w1920-h1080-k-no,https://lh5.googleusercontent.com/p/AF1QipPx2U-bYSyGLYsA5Me4RmAvymygFnsVdUd-GI24=w1920-h1080-k-no"
154,"4H2P+W8V, Escorts, East Colony, Bengaluru, Karnataka 560064, India",Bengaluru,,13.1023664,77.5858063,,Karnataka,"4H2P+W8V, Escorts",Yelahanka Car tower,4.6,Tourist attraction,"https://lh5.googleusercontent.com/p/AF1QipN_zdAEY41PAbvYFDsxldY_wJzFFEja2Z1eo7hL=w1920-h1080-k-no,https://lh5.googleusercontent.com/p/AF1QipNB-sThbUfIHObwWw_Hdi2pbEW5T_sQypIrC8Kp=w1920-h1080-k-no"
155,"Vasanth Nagar, Bengaluru, Karnataka 560052, India",Bengaluru,"Modern royal palace modeled on Windsor Castle offering tours, outdoor concerts & an amusement park.",12.998766,77.5921071,,Karnataka,,Bengaluru Palace,4.2,"Tourist attraction, Historical landmark, Historical place museum","https://lh5.googleusercontent.com/p/AF1QipNHvBtoADn3vXrixppCjv6seso2g07iqNJ-sbWS=w1920-h1080-k-no,https://lh5.googleusercontent.com/p/AF1QipMGRomDA19AzW2W2GKlY3OwJJkYfHDFto-NQJzv=w1920-h1080-k-no"
156,"40, Ambedkar Veedhi, Velsusamy Puram, Karur, Tamil Nadu 639002, India",Karur,,12.9818902,77.594504,,Tamil Nadu,40,Devaraj,,Tourist attraction,
157,"3GPR+RXR, Nadaprabhu Kempe Gowda Park, Charming Heights Rd, Vinayak Nagar, Vidyaranyapura, Bengaluru, Karnataka 560097, India",Bengaluru,,13.087105,77.542388,,Karnataka,"3GPR+RXR, Nadaprabhu Kempe Gowda Park, Charming Heights Rd","Hollywood Baba, PEACE ZONE",4.9,Tourist attraction,"https://lh5.googleusercontent.com/p/AF1QipPVvxZqAooi_U8eJVL0iBqEmD00Z3iIcLqOBPIb=w1920-h1080-k-no,https://lh5.googleusercontent.com/p/AF1QipMzkfhcr85jSwadgG2Pv5g2BOzurN82NEU-1rtj=w1920-h1080-k-no"
158,"3G6R+R5P, Renaissance HVV Villas, Jalahalli, Bengaluru, Karnataka 560015, India",Bengaluru,,13.0620785,77.5404459,,Karnataka,3G6R+R5P,Jarakabandi State Forest,4.2,"Tourist attraction, Forestry service, National forest","https://lh5.googleusercontent.com/p/AF1QipO3kub2vuhikI2GFAm6f--gaWrc9Dm3d9UTpl-p=w1920-h1080-k-no,https://lh5.googleusercontent.com/p/AF1QipOZVU5D8hfLDhhcXIaBapnUJk-V96oXjn8o8jvj=w1920-h1080-k-no"
159,"3J86+R7R, Rachenahalli, Thanisandra, Bengaluru, Karnataka 560064, India",Bengaluru,,13.0671069,77.6106311,,Karnataka,3J86+R7R,Model Village,4.6,"Tourist attraction, Museum","https://lh5.googleusercontent.com/p/AF1QipPOZ_gcs2yqSOg0GHFpcao9-AAPlPiXhnxii7K3=w1920-h1080-k-no,https://lh5.googleusercontent.com/p/AF1QipO_VSWqtKiQlfVSG-zy4OI4LTTG5CZEzHtgNmIN=w1920-h1080-k-no"
160,"XHJW+7R8, Ambedkar Veedhi, Sampangi Rama Nagar, Bengaluru, Karnataka 560001, India",Bengaluru,,12.9806644,77.5970675,,Karnataka,XHJW+7R8,HAL Aircraft Display,4.6,Tourist attraction,"https://lh5.googleusercontent.com/p/AF1QipMnDh1t3q-I3BoKyC95wVxEckzDepLb6XDcMbRY=w1920-h1080-k-no,https://lh5.googleusercontent.com/p/AF1QipMJJ4_IG66lVgbrJPA7z9sE-tFLog7smCzTZjVO=w1920-h1080-k-no"
161,"Gate, Outer Ring Rd, Nagavara, Bengaluru, Karnataka 560045, India",Bengaluru,"This lakeside park has colorful pedal boats for rent, plus a swimming pool & children's rides.",13.0434124,77.6096254,,Karnataka,"Gate, Outer Ring Rd",Lumbini Gardens,3.5,"Tourist attraction, Amusement park, Swimming pool, Water park","https://lh5.googleusercontent.com/p/AF1QipOMB36Zi93KQY-5lAykkmoqtu-qv-VsZy8CJn57=w1920-h1080-k-no,https://lh5.googleusercontent.com/p/AF1QipMDEqY0fCBOh4Gr4rDqA1tfEdJ19VpE6SZUhrnD=w1920-h1080-k-no"
162,"1st floor, Snow city, Jayamahal Main Rd, opposite TV Tower, J.C.Nagar, Bengaluru, Karnataka 560006, India",Bengaluru,,13.0058644,77.5920921,,Karnataka,"1st floor, Snow city, Jayamahal Main Rd, opposite TV Tower",The MadLabs: Where Fun Meets Science,4.8,"Tourist attraction, Museum","https://lh5.googleusercontent.com/p/AF1QipNvb2UwddrM-j-7xehzM8-QrKh_u90WHtVcP1hO=w1920-h1080-k-no,https://lh5.googleusercontent.com/p/AF1QipN646uDBftr2Xq1J0sHVsyn_gAYm4_Mj4ymh-BH=w1920-h1080-k-no"
163,"Sri Venkateshpura Layout, Sampigehalli, Bengaluru, Karnataka 560077, India",Bengaluru,,13.0795707,77.623174,,Karnataka,,Watch Tower - sunset and lake view tower,4.0,Tourist attraction,"https://lh5.googleusercontent.com/p/AF1QipMrVQNb60YvPPa7LYBSKx2tpYOyzryob3WdnKZD=w1920-h1080-k-no,https://lh5.googleusercontent.com/p/AF1QipNS69zZ7gHCF7d9le2alnvFYmOv9s5IQERRUH2M=w1920-h1080-k-no"
164,"WJQJ+C88, Ejipura, Bengaluru, Karnataka 560047, India",Bengaluru,,12.9385333,77.6308174,,Karnataka,WJQJ+C88,View Point,,Tourist attraction,
165,"VHGX+RPW, Cave Temple Rd, Pai Layout, Hulimavu, Bengaluru, Karnataka 560076, India",Bengaluru,"This unique, historic temple inside a cave has a serene atmosphere & is home to several Hindu idols.",12.8771015,77.5993367,,Karnataka,"VHGX+RPW, Cave Temple Rd",Cave Temple,4.6,"Tourist attraction, Hindu temple","https://lh5.googleusercontent.com/p/AF1QipPiP4-OTfCtxJhUqx_Tq5ZIHyYqv9GWAH3bNcW_=w1920-h1080-k-no,https://lh5.googleusercontent.com/p/AF1QipP58Kgdl8gsniePkBcJQU7QFMpHuVsaakXCd9XT=w1920-h1080-k-no"
166,"5, 7th Cross Rd, KAS Officers Colony, BTM 2nd Stage, Bommanahalli, Bengaluru, Karnataka 560068, India",Bengaluru,,12.9127505,77.6216988,,Karnataka,"5, 7th Cross Rd",BTM lake Bridge,4.2,Tourist attraction,"https://lh5.googleusercontent.com/p/AF1QipMdV7BMMKpj5yNNiEDssyoz5LJfqf6BzeXI_LJ0=w1920-h1080-k-no,https://lh5.googleusercontent.com/p/AF1QipORQgdjP3E4kx2pKj-85DnHS2PM9tMy31ZLwqOE=w1920-h1080-k-no"
167,"Kanakapura Rd, near Gokulam Apartments, Vaikunta Hill, Vasantha Vallabha Nagar, Bikasipura, Bengaluru, Karnataka 560061, India",Bengaluru,"Hindu temple combining modern & traditional architectural styles, with panoramic hilltop views.",12.8931784,77.5492136,,Karnataka,"Kanakapura Rd, near Gokulam Apartments",ISKCON Sri Rajadhiraja Govinda Temple,4.6,"Tourist attraction, Place of worship, Hindu temple","https://lh5.googleusercontent.com/p/AF1QipMEiO1FPd4oSL_Q2fABOgzMK8hDc_cifeLvIOV1=w1920-h1080-k-no,https://lh5.googleusercontent.com/p/AF1QipM0fsOSl3Qo34HpjvbqBZBvJ7guxDetILLDQdcn=w1920-h1080-k-no"
168,"XJM7+982, Sivanchetti Gardens, Bengaluru, Karnataka 560042, India",Bengaluru,,12.9833787,77.6132812,,Karnataka,XJM7+982,Narain Charities,,Tourist attraction,
169,"No 20, ,SRS road, 2 nd cross post, Ganigarapalya, Adarsha Layout, Talaghattapura, Bengaluru, Karnataka 560062, India",Bengaluru,,12.8726303,77.5321373,,Karnataka,"No 20, ,SRS road, 2 nd cross post",Girisha,2.5,Tourist attraction,https://lh5.googleusercontent.com/p/AF1QipP9G_ORgqRXVuZXUN-cyLVQZ-twCtJFH7Rz3BxD=w1920-h1080-k-no
170,"VMQ4+R3W, Kudlu, VGP Layout, Bengaluru, Karnataka 560068, India",Bengaluru,,12.889623,77.65519,,Karnataka,VMQ4+R3W,Best hotel ever,,Tourist attraction,
171,"WJ48+8F5, EWS Colony, Stage 2, LayoutLake, Bengaluru, Karnataka 560068, India",Bengaluru,,12.9057608,77.6162366,,Karnataka,WJ48+8F5,BTM Layout Lake,4.2,Tourist attraction,"https://lh5.googleusercontent.com/p/AF1QipOJzxHny-dAjsrXiqqwXSTmY8gj3L89ZTrf-dk=w1920-h1080-k-no,https://lh5.googleusercontent.com/p/AF1QipN03SPn2zFBso_I_p5lq7pggalQLvf1XJubfrgT=w1920-h1080-k-no"
172,"WJ49+8GH, EWS Colony, BTM 2nd Stage, BTM Layout, Bengaluru, Karnataka 560068, India",Bengaluru,,12.905815,77.6188685,,Karnataka,WJ49+8GH,Mallauppi lake view,4.0,Tourist attraction,"https://lh5.googleusercontent.com/p/AF1QipMZU_FQfqrVn2nZ6buuD__JIHhbs7w7HVbHCWzp=w1920-h1080-k-no,https://lh5.googleusercontent.com/p/AF1QipMXL4viJdaBl7qZy0YFx2ufCE46Wpexchai95S6=w1920-h1080-k-no"
173,"2087, 24th Main Rd, Vanganahalli, 1st Sector, HSR Layout, Bengaluru, Karnataka 560102, India",Bengaluru,,12.9129145,77.6492962,,Karnataka,"2087, 24th Main Rd",Big Banyan Tree,4.6,"Tourist attraction, Shopping mall","https://lh5.googleusercontent.com/p/AF1QipNqMMtLTPe77hnmfFxo2ynLIHxyI_0t6DhG8SME=w1920-h1080-k-no,https://lh5.googleusercontent.com/p/AF1QipOkLT0Z6dl_oBtgEBi6SdNNY0IfKS3XRBy1-RcJ=w1920-h1080-k-no"
174,"Aris Global, 100 Feet Ring Rd, 3rd Phase, J. P. Nagar, Bengaluru, Karnataka 560078, India",Bengaluru,"Narrow park with a jogging trail shaded by tall trees, plus a kids' playground & exercise equipment.",12.9116185,77.5986986,,Karnataka,"Aris Global, 100 Feet Ring Rd",Mini Forest,4.4,"Tourist attraction, Garden, Park","https://lh5.googleusercontent.com/p/AF1QipM4L7zorecp7zeTmbaYj97zGjTdY5R6g6cNlCfi=w1920-h1080-k-no,https://lh5.googleusercontent.com/p/AF1QipOle4f10RDxch8-HX4pB_MUkoAwpqsslqXJk21G=w1920-h1080-k-no"
175,"3rd Cross, 4th Main Rd, Balaji Layout, Hongasandra, Bengaluru, Karnataka 560068, India",Bengaluru,,12.8976879,77.624416,,Karnataka,"3rd Cross, 4th Main Rd",Balaji layout KARNATAKA FLAG,5.0,Tourist attraction,"https://lh5.googleusercontent.com/p/AF1QipN3RBDPfibNvK735K2Ary8sCf0x4v3PtPvXf2Zw=w1920-h1080-k-no,https://lh5.googleusercontent.com/p/AF1QipPkJ3KrYExbMcgtZAV1sx811NNyAxqOFfct5Npk=w1920-h1080-k-no"
176,"Gottigere Main Rd, Jumbo Sawari, Royal County, Royal Lake Front Phase1 and 2, Gottigere, Bengaluru, Karnataka 560076, India",Bengaluru,,12.8607789,77.5857306,,Karnataka,Gottigere Main Rd,National consumer fair aqua tunnel show,2.8,Tourist attraction,"https://lh5.googleusercontent.com/p/AF1QipP8RcrSbKNlYkXE5jPgam_k9XXusgPcLL8AmhQ-=w1920-h1080-k-no,https://lh5.googleusercontent.com/p/AF1QipMChBQjWWdMVXPdYzwbIfpmhZpe63LquUSw3ZBa=w1920-h1080-k-no"
177,"Hosur Main Road, Sattar Layout, Lakkasandra, Laljinagar, Wilson Garden, Bengaluru, Karnataka 560029, India",Bengaluru,"Medical science museum with human brain samples, live neuroanatomy demonstrations & guided tours.",12.9404644,77.5988183,,Karnataka,Hosur Main Road,NIMHANS Brain Museum,4.5,"Tourist attraction, Museum","https://lh5.googleusercontent.com/p/AF1QipN8B9zS0t53sQaYpBi1MXVIySL4NfbvymyDKAOd=w1920-h1080-k-no,https://lh5.googleusercontent.com/p/AF1QipPtf-Xz4GeeKM8_10BfzpgTpMIdB-2jhEUvr1Vp=w1920-h1080-k-no"
178,"VH48+822, BDA layout, Anjanapura Twp, Bengaluru, Karnataka 560108, India",Bengaluru,,12.8567491,77.5652995,,Karnataka,VH48+822,Leh Ladakh practice Road,5.0,Tourist attraction,
179,"30, 2nd Main Rd, Jaya Nagar 1st Block, Someshwara Nagar, Hombegowda Nagar, Bengaluru, Karnataka 560011, India",Bengaluru,,12.9432022,77.5945402,,Karnataka,"30, 2nd Main Rd",RUBINA TOURS & TRAVELS,,Tourist attraction,
180,"92, MCHS Colony, BTM 2nd Stage, BTM Layout, Bengaluru, Karnataka 560076, India",Bengaluru,,12.9104073,77.6157401,,Karnataka,92,BTM lake view,4.3,Tourist attraction,"https://lh5.googleusercontent.com/p/AF1QipPCnfEYLOhZTqzV3CgMiH3L6Yhqrb8_KGFuuq7y=w1920-h1080-k-no,https://lh5.googleusercontent.com/p/AF1QipPSfegzdqcZdE-ja18ViDOK-AqDb_ZJyNPQpUmz=w1920-h1080-k-no"
181,"VJV3+7Q9, Sundar Ram Shetty Nagar, Bilekahalli, Bengaluru, Karnataka 560076, India",Bengaluru,,12.8931598,77.6044735,,Karnataka,VJV3+7Q9,O-Base,5.0,Tourist attraction,"https://lh5.googleusercontent.com/p/AF1QipOv9aoMbiB9NLZmBZtGxKIotogq2Qgh_RKJKIRl=w1920-h1080-k-no,https://lh5.googleusercontent.com/p/AF1QipNuJCarKRCPfltV3VMqsGf6v8iaYZ5MtnNotsJN=w1920-h1080-k-no"
182,"WJ7Q+CHQ, Sector 7, HSR Layout, Bengaluru, Karnataka 560102, India",Bengaluru,,12.9135782,77.6389791,,Karnataka,WJ7Q+CHQ,Childrens Park,4.0,"Tourist attraction, Park","https://lh5.googleusercontent.com/p/AF1QipPZxlFvEycEx5e2954Z3YLa0eBtezXzy3sPKIrS=w1920-h1080-k-no,https://lh5.googleusercontent.com/p/AF1QipM9GpRUZGEWbjgWFvhUKxt8YBcqQVSSaF3PJpcg=w1920-h1080-k-no"
183,"247, 1st Cross Rd, 1st Block, Jaya Nagar East, Jayanagar, Bengaluru, Karnataka 560029, India",Bengaluru,,12.936243,77.591623,,Karnataka,"247, 1st Cross Rd",Naren s house,,Tourist attraction,
184,"WJ57+3PM, EWS Colony, Stage 2, BTM Layout, Bengaluru, Karnataka 560068, India",Bengaluru,,12.907702,77.6143051,,Karnataka,WJ57+3PM,Walking track,5.0,Tourist attraction,
185,"VH5G+7V5, 5th Main Rd, Royal County, Kembathalli, Kothnur, Karnataka 560083, India",Kothnur,,12.8581425,77.577231,,Karnataka,"VH5G+7V5, 5th Main Rd",Kembattahalli Lake ಕೆಂಬತ್ತಳ್ಳಿ ಕೆರೆ,3.9,"Tourist attraction, Landmark","https://lh5.googleusercontent.com/p/AF1QipNu7fnpC_WDVEoT981Rk4W5QwL04mPwse5bY1aM=w1920-h1080-k-no,https://lh5.googleusercontent.com/p/AF1QipPifjdXo-bZ1NvKjacTr9Ai7MnMqEoH3rxL6ztJ=w1920-h1080-k-no"
186,"16, 7th Cross Rd, NGR Layout, KAS Officers Colony, Roopena Agrahara, Bommanahalli, Bengaluru, Karnataka 560068, India",Bengaluru,,12.9122167,77.6212769,,Karnataka,"16, 7th Cross Rd",BTM Lake Eastern Most Point,4.2,Tourist attraction,"https://lh5.googleusercontent.com/p/AF1QipMou5_KZQ0xfFuU-xiZK1UHorwy8tUviEVjG_0y=w1920-h1080-k-no,https://lh5.googleusercontent.com/p/AF1QipO1uCC7OHIrqzSQfSgFrefj4JmHbpvMtCPtO4nc=w1920-h1080-k-no"
187,"Shop No 303, Baga, Road, Goa 403516, India",Bengaluru,,12.9818922,77.594504,,Goa,"Shop No 303, Baga, Road",NATIONAL TOURS AND TRAVEL,,Tourist attraction,
188,"3HR3+X85, Adityanagar, Vidyaranyapura, Rajahmundry, Karnataka 560097, India",Rajahmundry,,13.0923956,77.553344,,Karnataka,3HR3+X85,Chikkabettahalli Lake,3.7,Tourist attraction,"https://lh5.googleusercontent.com/p/AF1QipOHXum3WdoYEc45ajCRswJxdy9FsfvAw2t6Hbl8=w1920-h1080-k-no,https://lh5.googleusercontent.com/p/AF1QipMeuBicHeGB2tPxFqeeSsEN-A035D-UYnnCRVxU=w1920-h1080-k-no"
189,"Venkateshwara Tours And Travels, 5th Block, HRBR Layout, Kalyan Nagar, Bengaluru, Karnataka 560043, India",Bengaluru,,13.0360164,77.6310672,,Karnataka,Venkateshwara Tours And Travels,Venkateshwara Tours And Travels,,Tourist attraction,
190,"WJ5P+F34, Sector 7, HSR Layout, Bengaluru, Karnataka 560102, India",Bengaluru,,12.9087576,77.6352847,,Karnataka,WJ5P+F34,Tycho crater,5.0,Tourist attraction,
191,"WJJ9+WP, John Nagar, Koramangala, Bengaluru, Karnataka 560034, India",Bengaluru,,12.9312458,77.620271,,Karnataka,WJJ9+WP,Deer Park,4.3,"Tourist attraction, Park, Animal park","https://lh5.googleusercontent.com/p/AF1QipMJLROi-cjxIIdkNUh2quSAISvYthu4gd1t7q5s=w1920-h1080-k-no,https://lh5.googleusercontent.com/p/AF1QipOmslNam2bLCasPdUKUfeyjcyjWFQva2j9rLZd9=w1920-h1080-k-no"
192,"WJF5+6GP, Tavarekere, Ramappa layout, 1st Stage, BTM Layout, Doddaballapura, Karnataka 560081, India",Doddaballapura,,12.9230978,77.6088166,,Karnataka,WJF5+6GP,Gatti,,Tourist attraction,
193,"WJ3J+MX3, Madina Nagar, Sector 7, Mangammanapalya, Bengaluru, Karnataka 560068, India",Bengaluru,,12.9041277,77.6324214,,Karnataka,WJ3J+MX3,Sultan circle,,Tourist attraction,
194,"WJ52+3F2, Vega City Mall, Bannerghatta Main Rd, Bengaluru, India",Bengaluru,,12.9076299,77.601155,,Karnataka,"WJ52+3F2, Vega City Mall, Bannerghatta Main Rd",Halucinate,,Tourist attraction,"https://lh5.googleusercontent.com/p/AF1QipMfFwqYHLYykmX0mMiHs6tpqx5hsHPMeAUgw-Qf=w1920-h1080-k-no,https://lh5.googleusercontent.com/p/AF1QipNzTc5tVon09zv-8MAaBiizFQi8kGwLAvlDk4Ft=w1920-h1080-k-no"
195,"1141, 21st A Cross Rd, Sector 3, HSR Layout, Bengaluru, Karnataka 560102, India",Bengaluru,"Popular place home to many types of trees & flowers, with a long walking track & play equipment.",12.9105579,77.6397773,,Karnataka,"1141, 21st A Cross Rd",Tree Park,4.5,"Tourist attraction, Park","https://lh5.googleusercontent.com/p/AF1QipN6K9qrX2XOcVOHNXZ3RvZaCkxs8svj7flxxjRX=w1920-h1080-k-no,https://lh5.googleusercontent.com/p/AF1QipNV-NoF8up0KcPIRCdrt_rp9EczmLgD3DsbXmhv=w1920-h1080-k-no"
196,"4J85+WGC Airport Road, Palanahalli Rd, beside Jaguar Showroom international, Vinayak Nagar, Yelahanka, Bengaluru, Karnataka 560064, India",Bengaluru,,13.1173594,77.6087995,,Karnataka,"4J85+WGC Airport Road, Palanahalli Rd, beside Jaguar Showroom international",Palanahalli Bridge,4.7,Tourist attraction,"https://lh5.googleusercontent.com/p/AF1QipNQn4sZn9uLJ1LlYxuRGkBM81HD4Z1IZ8DcPEVs=w1920-h1080-k-no,https://lh5.googleusercontent.com/p/AF1QipM4Xsvpkrct9SiPrtJhgivmJSMpw2r0qvEoKITM=w1920-h1080-k-no"
197,"Snn, RAJ SERENITY, Suraksha nagar, Yelenahalli, Begur, Bengaluru, Karnataka 560068, India",Bengaluru,,12.8590684,77.61459,,Karnataka,"Snn, RAJ SERENITY",Mallu Traveller Quilon,,Tourist attraction,
198,"Arekere MICO Layout Main Rd, Puttenahalli, JP Nagar 7th Phase, near MLR Convention Hall, Bengaluru, Karnataka 560076, India",Bengaluru,"Tree-shaded freshwater lake with a narrow jogging path, home to ducks & other birds.",12.8904142,77.5871901,,Karnataka,"Arekere MICO Layout Main Rd, Puttenahalli, JP Nagar 7th Phase, near MLR Convention Hall",Puttenahalli Lake,3.9,"Tourist attraction, Bird watching area, Park","https://lh5.googleusercontent.com/p/AF1QipMNQkl5kpo6Gvm7R1zwRGrtlACPWlfA8ip9L8F_=w1920-h1080-k-no,https://lh5.googleusercontent.com/p/AF1QipNM40TqnsrpMh-IbO0tqgVC91Rnm5kVAsL99OGl=w1920-h1080-k-no"
199,"VJ95+73P, Unnamed Road, Akshaya Vana, Hulimavu, Bengaluru, Karnataka 560076, India",Bengaluru,,12.868212,77.6077014,,Karnataka,"VJ95+73P, Unnamed Road",Rock City View,4.4,Tourist attraction,"https://lh5.googleusercontent.com/p/AF1QipMIrMFyCDSqL3xh1NLnx_ym3G2q8bEFe2AH6xMh=w1920-h1080-k-no,https://lh5.googleusercontent.com/p/AF1QipOkv3vaneFMNSAcd_Z8zACJRuKunxFcwBd33IZC=w1920-h1080-k-no"
200,"VJM9+P6C, Nyanapahalli Main Rd, 2nd Block, Addischetan Layout, Arekere, Bengaluru, Karnataka 560076, India",Bengaluru,,12.8843162,77.6180035,,Karnataka,"VJM9+P6C, Nyanapahalli Main Rd",Bande Park,4.4,"Tourist attraction, Park","https://lh5.googleusercontent.com/p/AF1QipMDTts3UFJgIEQfJ4P1wYeTU8JaNHmlAb2EAINo=w1920-h1080-k-no,https://lh5.googleusercontent.com/p/AF1QipPhFteUfNdOQu5LdRhkmJ1Gg8DPK603fiL9drNm=w1920-h1080-k-no"
201,"XH7G+49C, Krishna Rajendra Rd, New Tharagupet, Bengaluru, Karnataka 560002, India",Bengaluru,"Monumental, carved stone gate, one of few surviving elements of the city's 18th-century fort.",12.9628018,77.5758862,,Karnataka,"XH7G+49C, Krishna Rajendra Rd",Bengaluru Fort,4.0,"Tourist attraction, Historical landmark, Fortress","https://lh5.googleusercontent.com/p/AF1QipPMqV5_r21gYL4J3E9lAR2CwmaP6cd56nutHZ_Y=w1920-h1080-k-no,https://lh5.googleusercontent.com/p/AF1QipM7fDilDoZ582bdJwlwVCUBII8UPLTNSNqftpp-=w1920-h1080-k-no"
202,"WGRV+627, 8th Cross Rd, 1st phase Girinagar, Phase 2, Banashankari, Bengaluru, Karnataka 560085, India",Bengaluru,,12.9405477,77.5425569,,Karnataka,"WGRV+627, 8th Cross Rd",Sri Raghavendra Swamy Math,4.7,"Tourist attraction, Hindu temple","https://lh5.googleusercontent.com/p/AF1QipOwv7lFZCpnGRT9gn-ilgyH8DEw2CTYFevtabfE=w1920-h1080-k-no,https://lh5.googleusercontent.com/p/AF1QipMxm61_SAIt3VAwV-TDkAFfOL9zP-LGiFF41EdK=w1920-h1080-k-no"
203,"3rd Cross road, Nagasandra Main Rd, Thyagaraja Nagar, Basavanagudi, Bengaluru, Karnataka 560028, India",Bengaluru,,12.9353675,77.5716497,,Karnataka,"3rd Cross road, Nagasandra Main Rd",Ramanjaneya Swami Temple,4.6,"Tourist attraction, Hindu temple","https://lh5.googleusercontent.com/p/AF1QipM78Q5FPoZDjsSUMCUd3ONlcUNtTs5HavAVGL7F=w1920-h1080-k-no,https://lh5.googleusercontent.com/p/AF1QipPBwbsUIvDkdhiOYBKaN6U-bPCHW9EJxO2dNW9D=w1920-h1080-k-no"
204,"WHV7+R8R, 5th Main Rd, Srinivasanagara, Hanumanthnagar, Banashankari 1st Stage, Banashankari, Bengaluru, Karnataka 560019, India",Bengaluru,,12.9446167,77.5632595,,Karnataka,"WHV7+R8R, 5th Main Rd",Ramanjaneya Gudda Temple,4.7,"Tourist attraction, Hindu temple","https://lh5.googleusercontent.com/p/AF1QipOhbEIZxGvHkFs31PTVWsDkjImweEC1wg022Orf=w1920-h1080-k-no,https://lh5.googleusercontent.com/p/AF1QipOhh_UD9PotF1wgKf2DDF13zbPRtUL9rNqaAsQG=w1920-h1080-k-no"
205,"WHX9+45V, Ramakrishna Ashrama Cir, Gandhi Bazaar, Basavanagudi, Bengaluru, Karnataka 560004, India",Bengaluru,Statue of the eminent 19th century Hindu monk Swami Vivekananda erected on a busy roundabout.,12.9478686,77.5679233,,Karnataka,"WHX9+45V, Ramakrishna Ashrama Cir",Vivekananda Statue,4.6,Tourist attraction,"https://lh5.googleusercontent.com/p/AF1QipPeozdqR7LqOvyhAndNsGm-2Krq4PevEIra3vcO=w1920-h1080-k-no,https://lh5.googleusercontent.com/p/AF1QipN-ZIKZD3JOYk4iRNCXvW4UT21XveZtjIYNJqoK=w1920-h1080-k-no"
206,"WHMH+QWG, Rashtriya Vidyalaya Rd, Jayanagar, Bengaluru, Karnataka 560041, India",Bengaluru,"Landscaped recreation area with kids' play equipment, plus statues of kings & colorful sculptures.",12.9344251,77.5798235,,Karnataka,"WHMH+QWG, Rashtriya Vidyalaya Rd",Ranadheera Kanteerava Park,4.5,"Tourist attraction, Park","https://lh5.googleusercontent.com/p/AF1QipP6HKI0UBFXqMg2nasM6WyGwXecWJEHHHvexG3S=w1920-h1080-k-no,https://lh5.googleusercontent.com/p/AF1QipPnOizh2wpWN1E0VvuCQsbkN1-cE-LGG41o1O24=w1920-h1080-k-no"
207,"XHHX+H8M, Queens Rd, Shivaji Nagar, Bengaluru, Karnataka 560001, India",Bengaluru,,12.978955,77.5982989,,Karnataka,"XHHX+H8M, Queens Rd",Gayle Six Place,,Tourist attraction,
208,"1st floor, Snow city, Fun World Complex, Jayamahal Main Rd, opposite TV Tower, J.C.Nagar, Bengaluru, Karnataka 560006, India",Bengaluru,"Ice & snow-themed indoor amusement park featuring frozen slides, rides & other family activities.",13.0057596,77.5920609,,Karnataka,"1st floor, Snow city, Fun World Complex, Jayamahal Main Rd, opposite TV Tower",Snow City,4.0,"Tourist attraction, Amusement park, Indoor snowcenter","https://lh5.googleusercontent.com/p/AF1QipMaSEKGuKnMkvSU-6tFpgTghkUxjcQbVwQEbAOV=w1920-h1080-k-no,https://lh5.googleusercontent.com/p/AF1QipOq4G-v0tDw46pU8rf9SR997q2qR0KHET5lJJVL=w1920-h1080-k-no"
209,"2MW9+4HV, Kanaka Sarovara Laek Road,Kalkere Horamavu, Post, Bengaluru, Karnataka 560113, India",Bengaluru,,13.0453625,77.6689182,,Karnataka,"2MW9+4HV, Kanaka Sarovara Laek Road,Kalkere Horamavu, Post",KANAKA SAROVARA LAKE,4.5,Tourist attraction,"https://lh5.googleusercontent.com/p/AF1QipPYBQLIL8zwaHaqrpjn6mt3DlKjpVSL2GEZoWHC=w1920-h1080-k-no,https://lh5.googleusercontent.com/p/AF1QipNAP9_wTC2TyvFsgxMsDu2xKBdRZgWT-aTI9KpE=w1920-h1080-k-no"
210,"VJWV+WRG, Hosapalaya, Muneshwara Nagar, Bengaluru, Karnataka 560068, India",Bengaluru,,12.8972258,77.6446291,,Karnataka,VJWV+WRG,Unit-3,,Tourist attraction,
211,"5, Kodichikknahalli, Lake City, Bommanahalli, Bengaluru, Karnataka 560068, India",Bengaluru,,12.8980601,77.6127176,,Karnataka,5,BTM Lake Southern Most Point,2.0,Tourist attraction,
